{
  "schema_version": 1,
  "episode_date": "2026-09-04",
  "status": "pre_recording",
  "timing": {
    "basis": "estimated_script_words",
    "words_per_second": 2.5,
    "duration_seconds": 903.6,
    "requires_recording_retime": true,
    "warning": "Timeline positions are editorial estimates until real A-roll is ingested and aligned. Do not treat these timestamps as frame-accurate."
  },
  "sources": {
    "script": "scripts/2026-09-04/script.txt",
    "script_sections": "scripts/2026-09-04/script_sections.json",
    "media_plan": "real-episode replay with current deterministic planner",
    "media_manifest": "historical run did not persist downloaded multimedia assets",
    "script_sha256": "a68983c175dd921503d51064f47f8fd859918104d5eb715eeab26f3c208c1d17"
  },
  "editing_defaults": {
    "base_visual": "presenter",
    "director_signal_authority": "suggestion",
    "tracks": {
      "presenter": "V1",
      "b_roll": "V2",
      "graphics": "V3",
      "titles": "V4"
    },
    "principle": "Presenter is visual continuity. Cut away only when media adds evidence, explanation, context, emotional grounding, analogy, contrast, or intentional rhythm."
  },
  "readiness": {
    "pre_recording_contract_valid": true,
    "ready_for_recording": true,
    "asset_resolution_complete": false,
    "ready_for_automated_timeline_import": false,
    "blockers": [
      "missing_manifest_asset",
      "recording_retime_required"
    ]
  },
  "summary": {
    "segment_count": 34,
    "media_segment_count": 15,
    "presenter_segment_count": 19,
    "media_cue_count": 15,
    "manifest_asset_record_count": 0,
    "resolved_media_cue_count": 0,
    "blocked_media_cue_count": 15
  },
  "validation_warnings": [
    "Real approved episode replay: the historical 2026-09-04 run did not persist downloaded multimedia assets; director cues were regenerated with the current deterministic planner."
  ],
  "timeline": [
    {
      "segment_id": "seg_001",
      "mode": "media",
      "start_seconds": 0,
      "end_seconds": 3.5,
      "duration_seconds": 3.5,
      "cue_id": "slot_001",
      "section": {
        "section_key": "opening",
        "kind": "opening",
        "beat_id": null,
        "beat_kind": null,
        "evidence_ids": []
      },
      "script_anchor": {
        "mode": "estimated_word_timing",
        "excerpt": "Una respuesta puede ser impecable y aun así dejar una pregunta incómoda sobre la mesa: si apagamos la pantalla justo ahora, ¿sabemos realmente qué hacer después? No hablo …"
      },
      "director": {
        "authority": "suggestion",
        "priority": "high",
        "intent": "Deterministic dense cold open: motion-first visual",
        "visual_role": "rhythm",
        "transition_in": "hard_cut",
        "transition_out": "hard_cut",
        "treatment": "natural_motion",
        "pacing": "fast",
        "return_to_presenter": false,
        "note": "Cold open: use a short, concrete moving shot. Prefer specificity over generic AI imagery; let adjacent opening cues form one visual sequence before returning to camera."
      },
      "media": {
        "available": false,
        "usable_for_edit": false,
        "file_exists": false,
        "blockers": [
          "missing_manifest_asset"
        ],
        "file": "",
        "asset_type": "",
        "preferred_asset_type": "video",
        "visual_query": "cinematic close-up hands highlighting research notes documentary b-roll",
        "on_screen_text": ""
      }
    },
    {
      "segment_id": "seg_002",
      "mode": "media",
      "start_seconds": 3.5,
      "end_seconds": 7,
      "duration_seconds": 3.5,
      "cue_id": "slot_002",
      "section": {
        "section_key": "opening",
        "kind": "opening",
        "beat_id": null,
        "beat_kind": null,
        "evidence_ids": []
      },
      "script_anchor": {
        "mode": "estimated_word_timing",
        "excerpt": "Una respuesta puede ser impecable y aun así dejar una pregunta incómoda sobre la mesa: si apagamos la pantalla justo ahora, ¿sabemos realmente qué hacer después? No hablo …"
      },
      "director": {
        "authority": "suggestion",
        "priority": "high",
        "intent": "Deterministic dense cold open: motion-first visual",
        "visual_role": "rhythm",
        "transition_in": "hard_cut",
        "transition_out": "hard_cut",
        "treatment": "natural_motion",
        "pacing": "fast",
        "return_to_presenter": false,
        "note": "Cold open: use a short, concrete moving shot. Prefer specificity over generic AI imagery; let adjacent opening cues form one visual sequence before returning to camera."
      },
      "media": {
        "available": false,
        "usable_for_edit": false,
        "file_exists": false,
        "blockers": [
          "missing_manifest_asset"
        ],
        "file": "",
        "asset_type": "",
        "preferred_asset_type": "video",
        "visual_query": "moving archival documents handwritten notes desk documentary footage",
        "on_screen_text": ""
      }
    },
    {
      "segment_id": "seg_003",
      "mode": "media",
      "start_seconds": 7,
      "end_seconds": 10.5,
      "duration_seconds": 3.5,
      "cue_id": "slot_003",
      "section": {
        "section_key": "opening",
        "kind": "opening",
        "beat_id": null,
        "beat_kind": null,
        "evidence_ids": []
      },
      "script_anchor": {
        "mode": "estimated_word_timing",
        "excerpt": "… dejar una pregunta incómoda sobre la mesa: si apagamos la pantalla justo ahora, ¿sabemos realmente qué hacer después? No hablo sólo de una tarea escolar. Piensa en un …"
      },
      "director": {
        "authority": "suggestion",
        "priority": "high",
        "intent": "Deterministic dense cold open: motion-first visual",
        "visual_role": "rhythm",
        "transition_in": "hard_cut",
        "transition_out": "hard_cut",
        "treatment": "natural_motion",
        "pacing": "fast",
        "return_to_presenter": false,
        "note": "Cold open: use a short, concrete moving shot. Prefer specificity over generic AI imagery; let adjacent opening cues form one visual sequence before returning to camera."
      },
      "media": {
        "available": false,
        "usable_for_edit": false,
        "file_exists": false,
        "blockers": [
          "missing_manifest_asset"
        ],
        "file": "",
        "asset_type": "",
        "preferred_asset_type": "video",
        "visual_query": "investigative evidence wall notes connecting lines cinematic b-roll",
        "on_screen_text": ""
      }
    },
    {
      "segment_id": "seg_004",
      "mode": "media",
      "start_seconds": 10.5,
      "end_seconds": 14,
      "duration_seconds": 3.5,
      "cue_id": "slot_004",
      "section": {
        "section_key": "opening",
        "kind": "opening",
        "beat_id": null,
        "beat_kind": null,
        "evidence_ids": []
      },
      "script_anchor": {
        "mode": "estimated_word_timing",
        "excerpt": "… apagamos la pantalla justo ahora, ¿sabemos realmente qué hacer después? No hablo sólo de una tarea escolar. Piensa en un médico que recibe una síntesis perfecta de un …"
      },
      "director": {
        "authority": "suggestion",
        "priority": "high",
        "intent": "Deterministic dense cold open: motion-first visual",
        "visual_role": "rhythm",
        "transition_in": "hard_cut",
        "transition_out": "hard_cut",
        "treatment": "natural_motion",
        "pacing": "fast",
        "return_to_presenter": false,
        "note": "Cold open: use a short, concrete moving shot. Prefer specificity over generic AI imagery; let adjacent opening cues form one visual sequence before returning to camera."
      },
      "media": {
        "available": false,
        "usable_for_edit": false,
        "file_exists": false,
        "blockers": [
          "missing_manifest_asset"
        ],
        "file": "",
        "asset_type": "",
        "preferred_asset_type": "video",
        "visual_query": "abstract flowing data traces light paths cinematic technology footage",
        "on_screen_text": ""
      }
    },
    {
      "segment_id": "seg_005",
      "mode": "media",
      "start_seconds": 14,
      "end_seconds": 17.5,
      "duration_seconds": 3.5,
      "cue_id": "slot_005",
      "section": {
        "section_key": "opening",
        "kind": "opening",
        "beat_id": null,
        "beat_kind": null,
        "evidence_ids": []
      },
      "script_anchor": {
        "mode": "estimated_word_timing",
        "excerpt": "… después? No hablo sólo de una tarea escolar. Piensa en un médico que recibe una síntesis perfecta de un historial clínico. En un abogado que revisa un documento …"
      },
      "director": {
        "authority": "suggestion",
        "priority": "high",
        "intent": "Deterministic dense cold open: motion-first visual",
        "visual_role": "rhythm",
        "transition_in": "hard_cut",
        "transition_out": "hard_cut",
        "treatment": "natural_motion",
        "pacing": "fast",
        "return_to_presenter": false,
        "note": "Cold open: use a short, concrete moving shot. Prefer specificity over generic AI imagery; let adjacent opening cues form one visual sequence before returning to camera."
      },
      "media": {
        "available": false,
        "usable_for_edit": false,
        "file_exists": false,
        "blockers": [
          "missing_manifest_asset"
        ],
        "file": "",
        "asset_type": "",
        "preferred_asset_type": "video",
        "visual_query": "person carefully reviewing papers computer screen documentary footage",
        "on_screen_text": ""
      }
    },
    {
      "segment_id": "seg_006",
      "mode": "media",
      "start_seconds": 17.5,
      "end_seconds": 20,
      "duration_seconds": 2.5,
      "cue_id": "slot_006",
      "section": {